{
  "format_version": 2,
  "generated_by": "scripts/generate_telemetry_registry.py",
  "generator_version": 4,
  "registry_schema_version": 1,
  "registry_version": 1,
  "bucket_catalog_version": 1,
  "materialized_view_sha256": "4db020882cd3277e90863f3db88eeb8ea535ac1807a6ba5fc8bcc3e80a699014",
  "canonical_import_order": [
    "genai.yaml",
    "security.yaml",
    "operations.yaml"
  ],
  "inputs": [
    {
      "path": "schemas/telemetry/v8/registry.yaml",
      "sha256": "2be1d92040db77e734f58b0c9819d99082a6495a52d4769dfa47f1ff982aa8c6"
    },
    {
      "path": "schemas/telemetry/v8/output-manifest.schema.json",
      "sha256": "9d2819a8c81af7af7e4bb056065bc8f5e0c61da117aa9054f4664b2b81e70501"
    },
    {
      "path": "schemas/telemetry/v8/compatibility/v7-exporter-selection.schema.json",
      "sha256": "7a7dc0390095a34846060cc3b1f42963b2cd45ffce276391da81aa59b4f27fc8"
    },
    {
      "path": "schemas/telemetry/v8/public-views.yaml",
      "sha256": "f633fbbd6708c26b1e44fb4324eca7cae16ebbd5e49530aa493eb150d8ee583a"
    },
    {
      "path": "schemas/telemetry/v8/baselines/public-schemas-v7.normalized.json",
      "sha256": "d44ea610e9e82b142788babce9c8853713aa004a037c6bd2684502c80a1ca2b3"
    },
    {
      "path": "schemas/telemetry/v8/genai.yaml",
      "sha256": "a5dcab82fbf7779a12419f4e87e28f884d4ce0800a6aecb40ffdc635077deecc"
    },
    {
      "path": "schemas/telemetry/v8/security.yaml",
      "sha256": "43829ee44823b9c6a0b28495f919bdab993cf4cdbcd60954da392180ba0cae60"
    },
    {
      "path": "schemas/telemetry/v8/operations.yaml",
      "sha256": "0d97774571893838e8ab162d76fcb0c7460726464c3165db48a429704091d218"
    },
    {
      "path": "schemas/telemetry/v8/semconv.lock.yaml",
      "sha256": "ef3caf547a94716be8572296c23bca3b6f8006cc77029b8fcc573beab789cd7a"
    },
    {
      "path": "schemas/telemetry/v8/upstream/otel-genai-b028dceecdad117461a785c3af35315e7184e813/model/gen-ai/gen-ai-input-messages.json",
      "sha256": "034fcd8c87f1e013f3a5a5018503210e2bee4d2499c361823b96e906d40a50ad"
    },
    {
      "path": "schemas/telemetry/v8/upstream/otel-genai-b028dceecdad117461a785c3af35315e7184e813/model/gen-ai/gen-ai-output-messages.json",
      "sha256": "a825a6c0cc1b7b22fdbfb9488d8dc3a318be3897ef6d3dbae01a10297bb6e569"
    },
    {
      "path": "schemas/telemetry/v8/upstream/otel-genai-b028dceecdad117461a785c3af35315e7184e813/model/gen-ai/gen-ai-tool-call-arguments.json",
      "sha256": "73607a8e8d9e84393475ef460108c59dbb9e1d2ddc0d0177fce6f735a62367ea"
    },
    {
      "path": "schemas/telemetry/v8/upstream/otel-genai-b028dceecdad117461a785c3af35315e7184e813/model/gen-ai/gen-ai-tool-call-result.json",
      "sha256": "44eb4a93b05eea7da14489f1d253814c6429772d1fe869f8f6fc1749d7593412"
    },
    {
      "path": "docs/design/observability-v8/current-state-inventory.yaml",
      "sha256": "04bae958c17440b6e80068f3455ad5b36ea28f4b6f5c190b54b58944ee4859fc"
    },
    {
      "path": "schemas/telemetry/v8/examples.yaml",
      "sha256": "4b86c051a04c6d510bd2651fc0f4b9348f224adb9fb83f592a2b3e3901061882"
    }
  ],
  "snapshots": [
    {
      "dependency_id": "otel_core",
      "path": "schemas/telemetry/v8/upstream/otel-core-v1.42.0.normalized.json",
      "sha256": "609177ec1aba35688f941ecec289aac1776301c442ae06553822c881289e4f5a"
    },
    {
      "dependency_id": "otel_genai",
      "path": "schemas/telemetry/v8/upstream/otel-genai-b028dceecdad117461a785c3af35315e7184e813.normalized.json",
      "sha256": "48d450685930c9a8734aa4b49f79985c4c5c20ef37922aa0bb4e8e36cbfc6156"
    },
    {
      "dependency_id": "openinference",
      "path": "schemas/telemetry/v8/upstream/openinference-v0.1.30.normalized.json",
      "sha256": "997d963568174711f233834b40374d8a06d68c9b9ef2cd26cf46516cb72121ff"
    }
  ],
  "upstream_ownership_transitions": [
    {
      "attribute": "gen_ai.request.top_k",
      "from_dependency": "otel_core",
      "to_dependency": "otel_genai",
      "from_allowed_types": [
        "double"
      ],
      "to_allowed_types": [
        "int64"
      ],
      "disposition": "breaking_type_correction_to_dedicated_genai"
    }
  ],
  "upstream_compatibility_overlaps": [
    {
      "attribute": "session.id",
      "canonical_owner": "otel_core",
      "compatibility_provenance": "openinference"
    },
    {
      "attribute": "user.id",
      "canonical_owner": "otel_core",
      "compatibility_provenance": "openinference"
    }
  ],
  "legacy_only_upstream_attributes": [
    "gen_ai.completion",
    "gen_ai.openai.request.response_format",
    "gen_ai.openai.request.seed",
    "gen_ai.openai.request.service_tier",
    "gen_ai.openai.response.service_tier",
    "gen_ai.openai.response.system_fingerprint",
    "gen_ai.prompt",
    "gen_ai.system",
    "gen_ai.usage.completion_tokens",
    "gen_ai.usage.prompt_tokens"
  ],
  "outputs": [
    "internal/cli/embed/scan-result.json",
    "internal/gatewaylog/schemas/activity-event.json",
    "internal/gatewaylog/schemas/gateway-event-envelope.json",
    "internal/gatewaylog/schemas/scan-event.json",
    "internal/gatewaylog/schemas/scan-finding-event.json",
    "internal/observability/zz_generated_telemetry_builder_fixtures_test.go",
    "internal/observability/zz_generated_telemetry_builders_genai.go",
    "internal/observability/zz_generated_telemetry_builders_operations.go",
    "internal/observability/zz_generated_telemetry_builders_security.go",
    "internal/observability/zz_generated_telemetry_catalog.go",
    "internal/observability/zz_generated_telemetry_ids.go",
    "internal/observability/zz_generated_telemetry_producers.go",
    "schemas/activity-event.json",
    "schemas/audit-event.json",
    "schemas/gateway-event-envelope.json",
    "schemas/hook-audit-envelope.json",
    "schemas/network-egress-event.json",
    "schemas/otel/agent-lifecycle-event.schema.json",
    "schemas/otel/asset-lifecycle-event.schema.json",
    "schemas/otel/connector-telemetry-event.schema.json",
    "schemas/otel/galileo-export-profile.schema.json",
    "schemas/otel/metrics.schema.json",
    "schemas/otel/resource.schema.json",
    "schemas/otel/runtime-agent-span.schema.json",
    "schemas/otel/runtime-alert-event.schema.json",
    "schemas/otel/runtime-approval-span.schema.json",
    "schemas/otel/runtime-llm-span.schema.json",
    "schemas/otel/runtime-tool-span.schema.json",
    "schemas/otel/scan-finding-event.schema.json",
    "schemas/otel/scan-result-event.schema.json",
    "schemas/scan-event.json",
    "schemas/scan-finding-event.json",
    "schemas/scan-result.json",
    "schemas/telemetry/generated/catalog.json",
    "schemas/telemetry/generated/catalog.md",
    "schemas/telemetry/generated/compatibility/galileo-rich-v2.json",
    "schemas/telemetry/generated/compatibility/inbound-otlp.json",
    "schemas/telemetry/generated/compatibility/local-observability-v1.json",
    "schemas/telemetry/generated/compatibility/openinference-v1.json",
    "schemas/telemetry/generated/compatibility/v7-exporter-selection.json",
    "schemas/telemetry/generated/examples/invalid/invalid-finding-whole-raw-evidence.json",
    "schemas/telemetry/generated/examples/invalid/invalid-finding-workflow-status.json",
    "schemas/telemetry/generated/examples/invalid/invalid-legacy-audit-as-canonical-family.json",
    "schemas/telemetry/generated/examples/invalid/invalid-lifecycle-phase-code-mismatch.json",
    "schemas/telemetry/generated/examples/invalid/invalid-metric-high-cardinality-label.json",
    "schemas/telemetry/generated/examples/invalid/invalid-span-family-bucket-mismatch.json",
    "schemas/telemetry/generated/examples/manifest.json",
    "schemas/telemetry/generated/examples/valid/valid-asset-scan-started.json",
    "schemas/telemetry/generated/examples/valid/valid-guardrail-judge-payload-log.json",
    "schemas/telemetry/generated/examples/valid/valid-hook-latency-metric.json",
    "schemas/telemetry/generated/examples/valid/valid-model-chat-with-honest-missing-content-and-usage.json",
    "schemas/telemetry/generated/examples/valid/valid-root-agent-lifecycle-transition.json",
    "schemas/telemetry/generated/examples/valid/valid-security-finding-with-derived-evidence.json",
    "schemas/telemetry/generated/examples/valid/valid-telemetry-rejection-without-raw-payload.json",
    "schemas/telemetry/generated/otlp-fixtures/cases/invalid-finding-whole-raw-evidence.json",
    "schemas/telemetry/generated/otlp-fixtures/cases/invalid-finding-workflow-status.json",
    "schemas/telemetry/generated/otlp-fixtures/cases/invalid-legacy-audit-as-canonical-family.json",
    "schemas/telemetry/generated/otlp-fixtures/cases/invalid-lifecycle-phase-code-mismatch.json",
    "schemas/telemetry/generated/otlp-fixtures/cases/invalid-metric-high-cardinality-label.json",
    "schemas/telemetry/generated/otlp-fixtures/cases/invalid-span-family-bucket-mismatch.json",
    "schemas/telemetry/generated/otlp-fixtures/cases/valid-asset-scan-started.json",
    "schemas/telemetry/generated/otlp-fixtures/cases/valid-guardrail-judge-payload-log.json",
    "schemas/telemetry/generated/otlp-fixtures/cases/valid-hook-latency-metric.json",
    "schemas/telemetry/generated/otlp-fixtures/cases/valid-model-chat-with-honest-missing-content-and-usage.json",
    "schemas/telemetry/generated/otlp-fixtures/cases/valid-root-agent-lifecycle-transition.json",
    "schemas/telemetry/generated/otlp-fixtures/cases/valid-security-finding-with-derived-evidence.json",
    "schemas/telemetry/generated/otlp-fixtures/cases/valid-telemetry-rejection-without-raw-payload.json",
    "schemas/telemetry/generated/otlp-fixtures/manifest.json",
    "schemas/telemetry/generated/output-manifest.json",
    "schemas/telemetry/generated/telemetry.schema.json"
  ],
  "ownership_inventory": {
    "format_version": 1,
    "manifest": {
      "path": "schemas/telemetry/generated/output-manifest.json",
      "mode": 420,
      "marker": "\"generated_by\": \"scripts/generate_telemetry_registry.py\""
    },